{
  "archive_version": 1,
  "exported_at": "2026-09-06T10:22:41Z",
  "account": {
    "user_id": "0a1b2c3d-4e5f-4061-8273-849506a7b8c9",
    "timezone": "Asia/Kolkata"
  },
  "topics": [
    {
      "id": "3f1a6c22-8b4e-4a91-9c3d-0e5f7a2b1d40",
      "name": "Learning techniques",
      "normalized_name": "learning techniques",
      "created_at": "2026-08-02T09:14:00Z",
      "checksum": "sha256:cc611eb624aa6d529e243da8341ceef901951a33352128f07a1561852e79b37f"
    }
  ],
  "tags": [
    {
      "id": "5c2b8e10-4d6a-4f83-b1c7-2a9e0f3d5b61",
      "name": "memory",
      "normalized_name": "memory",
      "created_at": "2026-08-02T09:14:00Z",
      "checksum": "sha256:fafe225efbb43b99e286a934545e136aa147a62eab83eb2bc0e4ecf9d6f4ee62"
    },
    {
      "id": "7a4d9f31-2e5b-4c07-8d6a-1b3f4e2c9a58",
      "name": "study habits",
      "normalized_name": "study habits",
      "created_at": "2026-08-11T18:02:31Z",
      "checksum": "sha256:38a8eeb519e8e0e63a690ad1ca3cd19b1bf3550c4058cd0f74f756ca8d361294"
    }
  ],
  "notes": [
    {
      "id": "9b7e2c40-1f3a-4d58-a6b2-5c8d0e1f7a93",
      "processing_state": "ready",
      "failure_stage": null,
      "saved_at": "2026-08-02T09:12:44Z",
      "created_at": "2026-08-02T09:12:44Z",
      "updated_at": "2026-08-14T20:31:09Z",
      "trashed_at": null,
      "purge_after": null,
      "primary_topic_id": "3f1a6c22-8b4e-4a91-9c3d-0e5f7a2b1d40",
      "tag_ids": [
        "5c2b8e10-4d6a-4f83-b1c7-2a9e0f3d5b61",
        "7a4d9f31-2e5b-4c07-8d6a-1b3f4e2c9a58"
      ],
      "active_revision_id": "c1d2e3f4-5a6b-4c7d-8e9f-0a1b2c3d4e5f",
      "source": {
        "video_id": "dQw4w9WgXcQ",
        "canonical_url": "https://www.youtube.com/watch?v=dQw4w9WgXcQ",
        "title": "How spaced repetition actually works",
        "channel": "Study Lab",
        "duration_seconds": 1873,
        "published_at": "2026-07-19"
      },
      "transcript": {
        "id": "2e4f6a80-3b5c-4d1e-9f70-8a2b4c6d8e01",
        "source_kind": "caption_human",
        "language_code": "en",
        "normalized_text": "Most people revise by rereading, which feels fluent and teaches very little. Spacing the same total minutes across several days forces retrieval, and it is the effort of retrieving that consolidates the memory.",
        "created_at": "2026-08-02T09:13:20Z"
      },
      "takeaway": {
        "text": "Try this on the statistics deck: one review tomorrow, one next Sunday.",
        "updated_at": "2026-08-14T20:31:09Z"
      },
      "revisions": [
        {
          "id": "a1b2c3d4-5e6f-4a7b-8c9d-0e1f2a3b4c5d",
          "revision_number": 1,
          "origin": "generated",
          "parent_revision_id": null,
          "generated_from_transcript_id": "2e4f6a80-3b5c-4d1e-9f70-8a2b4c6d8e01",
          "generation_instruction": null,
          "payload": {
            "schema_version": 1,
            "detected_language": "en",
            "primary_topic": "Learning techniques",
            "tags": ["memory", "study habits"],
            "summary": {
              "id": "s1",
              "text": "Spacing reviews over days beats one long session for durable recall.",
              "provenance": "ai",
              "source_refs": [
                {
                  "chunk_id": "c1",
                  "start": 0,
                  "end": 64,
                  "quote": "spaced repetition"
                }
              ]
            },
            "key_points": [
              {
                "id": "k1",
                "text": "Recall is stronger when reviews are separated in time.",
                "provenance": "ai",
                "source_refs": [
                  {
                    "chunk_id": "c1",
                    "start": 12,
                    "end": 70,
                    "quote": "spaced repetition"
                  }
                ]
              },
              {
                "id": "k2",
                "text": "Effortful retrieval is what consolidates a memory.",
                "provenance": "ai",
                "source_refs": [
                  {
                    "chunk_id": "c2",
                    "start": 4,
                    "end": 58,
                    "quote": "spaced repetition"
                  }
                ]
              },
              {
                "id": "k3",
                "text": "Cramming feels productive because fluency is mistaken for learning.",
                "provenance": "ai",
                "source_refs": [
                  {
                    "chunk_id": "c2",
                    "start": 61,
                    "end": 130,
                    "quote": "spaced repetition"
                  }
                ]
              },
              {
                "id": "k4",
                "text": "A first review within a day catches most of the forgetting curve.",
                "provenance": "ai",
                "source_refs": [
                  {
                    "chunk_id": "c3",
                    "start": 0,
                    "end": 62,
                    "quote": "spaced repetition"
                  }
                ]
              },
              {
                "id": "k5",
                "text": "Intervals can widen once recall becomes reliable.",
                "provenance": "ai",
                "source_refs": [
                  {
                    "chunk_id": "c3",
                    "start": 65,
                    "end": 118,
                    "quote": "spaced repetition"
                  }
                ]
              }
            ],
            "important_details": [
              {
                "id": "d1",
                "text": "The effect holds across ages and subject matter.",
                "provenance": "ai",
                "source_refs": [
                  {
                    "chunk_id": "c4",
                    "start": 0,
                    "end": 47,
                    "quote": "spaced repetition"
                  }
                ]
              },
              {
                "id": "d2",
                "text": "Sleep between sessions appears to matter more than total hours.",
                "provenance": "ai",
                "source_refs": [
                  {
                    "chunk_id": "c4",
                    "start": 50,
                    "end": 118,
                    "quote": "spaced repetition"
                  }
                ]
              },
              {
                "id": "d3",
                "text": "Self-testing outperforms re-reading at equal time cost.",
                "provenance": "ai",
                "source_refs": [
                  {
                    "chunk_id": "c5",
                    "start": 0,
                    "end": 55,
                    "quote": "spaced repetition"
                  }
                ]
              }
            ],
            "practical_actions": [
              {
                "id": "a1",
                "text": "Review new material once the next day, then after a week.",
                "provenance": "ai",
                "source_refs": [
                  {
                    "chunk_id": "c5",
                    "start": 58,
                    "end": 116,
                    "quote": "spaced repetition"
                  }
                ]
              }
            ],
            "diagram": {
              "schema_version": 1,
              "type": "mind_map",
              "nodes": [
                {
                  "id": "n1",
                  "label": "Spaced repetition",
                  "kind": "root",
                  "provenance": "ai",
                  "source_refs": [
                    {
                      "chunk_id": "c1",
                      "start": 0,
                      "end": 18,
                      "quote": "spaced repetition"
                    }
                  ]
                },
                {
                  "id": "n2",
                  "label": "Retrieval effort",
                  "kind": "branch",
                  "provenance": "ai",
                  "source_refs": [
                    {
                      "chunk_id": "c2",
                      "start": 4,
                      "end": 21,
                      "quote": "spaced repetition"
                    }
                  ]
                },
                {
                  "id": "n3",
                  "label": "Interval growth",
                  "kind": "branch",
                  "provenance": "ai",
                  "source_refs": [
                    {
                      "chunk_id": "c3",
                      "start": 65,
                      "end": 81,
                      "quote": "spaced repetition"
                    }
                  ]
                }
              ],
              "edges": [
                {
                  "id": "e1",
                  "from": "n1",
                  "to": "n2",
                  "order": 1
                },
                {
                  "id": "e2",
                  "from": "n1",
                  "to": "n3",
                  "order": 2
                }
              ],
              "collapsed_groups": [],
              "layout": {
                "engine": "radial"
              }
            }
          },
          "created_at": "2026-08-02T09:15:02Z"
        },
        {
          "id": "c1d2e3f4-5a6b-4c7d-8e9f-0a1b2c3d4e5f",
          "revision_number": 2,
          "origin": "manual",
          "parent_revision_id": "a1b2c3d4-5e6f-4a7b-8c9d-0e1f2a3b4c5d",
          "generated_from_transcript_id": null,
          "generation_instruction": null,
          "payload": {
            "schema_version": 1,
            "detected_language": "en",
            "primary_topic": "Learning techniques",
            "tags": ["memory", "study habits"],
            "summary": {
              "id": "s1",